{
  "$schema": "../../schemas/vector.schema.json",
  "id": "content/auto-tune-regenerate-note-split",
  "type": "request",
  "description": "AUTO regenerate with params.noteSplitCents, the note-split sensitivity of the note generator, over the same range and notes as content/auto-tune-regenerate. The notes in the range are replaced as there; how many are created depends on the audio and on the sensitivity. paramsUsed reports the sensitivity that was used, and the members left out take the generator defaults.",
  "capability": "edit.v1",
  "since": "1.0",
  "method": "content.autoTune",
  "session": "authenticated",
  "given": {
    "dirty": false,
    "clips": [
      {
        "bind": "clip",
        "trackId": 0,
        "startTimelineSec": 2,
        "durationSec": 6,
        "analysis": "ready",
        "notes": [
          {
            "startContentSec": 0.5,
            "endContentSec": 1.5,
            "targetMidi": 64
          },
          {
            "startContentSec": 2,
            "endContentSec": 3,
            "targetMidi": 69
          },
          {
            "startContentSec": 3.5,
            "endContentSec": 4.5,
            "targetMidi": 69.3
          },
          {
            "startContentSec": 5,
            "endContentSec": 5.8,
            "targetMidi": 66.2
          }
        ]
      }
    ]
  },
  "request": {
    "jsonrpc": "2.0",
    "id": 1,
    "method": "content.autoTune",
    "params": {
      "contentId": {
        "$ref": "clip.contentId"
      },
      "mode": "regenerate",
      "expectedRevision": {
        "$ref": "clip.revision"
      },
      "ranges": [
        {
          "startContentSec": 1,
          "endContentSec": 4
        }
      ],
      "key": {
        "root": 0,
        "scale": "major"
      },
      "params": {
        "noteSplitCents": 40
      }
    }
  },
  "response": {
    "jsonrpc": "2.0",
    "id": 1,
    "result": {
      "applied": true,
      "noOp": false,
      "dryRun": false,
      "changes": [],
      "created": {
        "$any": "array"
      },
      "removed": [
        {
          "entity": "note",
          "ref": {
            "contentId": {
              "$ref": "clip.contentId"
            },
            "note": {
              "index": 0,
              "atRevision": {
                "$ref": "clip.revision"
              }
            }
          },
          "label": {
            "$any": true
          }
        },
        {
          "entity": "note",
          "ref": {
            "contentId": {
              "$ref": "clip.contentId"
            },
            "note": {
              "index": 1,
              "atRevision": {
                "$ref": "clip.revision"
              }
            }
          },
          "label": {
            "$any": true
          }
        },
        {
          "entity": "note",
          "ref": {
            "contentId": {
              "$ref": "clip.contentId"
            },
            "note": {
              "index": 2,
              "atRevision": {
                "$ref": "clip.revision"
              }
            }
          },
          "label": {
            "$any": true
          }
        }
      ],
      "idMap": [],
      "revisionDiff": {
        "arrangement": null,
        "trackState": null,
        "contents": [
          {
            "contentId": {
              "$ref": "clip.contentId"
            },
            "changed": {
              "notes": {
                "before": {
                  "$any": "string"
                },
                "after": {
                  "$any": "string"
                }
              }
            }
          }
        ]
      },
      "tokens": {
        "arrangementRevision": {
          "$any": "string"
        },
        "contents": [
          {
            "contentId": {
              "$ref": "clip.contentId"
            },
            "revision": {
              "$any": "string"
            },
            "gridRevision": {
              "$ref": "clip.gridRevision"
            },
            "keyRevision": {
              "$ref": "clip.keyRevision"
            }
          }
        ],
        "placements": []
      },
      "undo": {
        "undoable": true,
        "undoId": {
          "$any": "string"
        },
        "description": {
          "$any": "string"
        },
        "innerActions": {
          "$any": "array"
        },
        "steps": 1
      },
      "dirty": {
        "before": false,
        "after": true
      },
      "ui": {
        "$any": true
      },
      "sideEffects": {
        "reRenderQueued": {
          "contentIds": [
            {
              "$ref": "clip.contentId"
            }
          ],
          "revert": null
        }
      },
      "warnings": [
        {
          "code": "DROPPED_BOUNDARY_NOTES",
          "subject": {
            "contentId": {
              "$ref": "clip.contentId"
            }
          },
          "data": {
            "notes": [
              {
                "note": {
                  "index": 0,
                  "atRevision": {
                    "$ref": "clip.revision"
                  }
                },
                "startContentSec": {
                  "$approx": 0.5
                },
                "endContentSec": {
                  "$approx": 1.5
                }
              },
              {
                "note": {
                  "index": 2,
                  "atRevision": {
                    "$ref": "clip.revision"
                  }
                },
                "startContentSec": {
                  "$approx": 3.5
                },
                "endContentSec": {
                  "$approx": 4.5
                }
              }
            ]
          }
        }
      ],
      "job": null,
      "omittedCount": {
        "changes": 0,
        "created": 0,
        "removed": 0
      },
      "mode": "regenerate",
      "keyUsed": {
        "root": 0,
        "scale": "major"
      },
      "paramsUsed": {
        "retuneSpeed": {
          "$any": "number"
        },
        "vibratoDepth": {
          "$any": "number"
        },
        "vibratoRateHz": {
          "$any": "number"
        },
        "noteSplitCents": 40
      },
      "noteCount": {
        "before": 4,
        "after": {
          "$any": "integer"
        }
      }
    }
  },
  "connectionAfter": "open"
}
